{
    "run_id":  "PH1_5-SYNTHETIC-THREAT-MODEL",
    "parent_id":  "root-coordinator",
    "requested_model":  "inherited",
    "actual_model":  "inherited_parent_gpt-5.5_not_independently_reported",
    "sandbox":  "instructional_bounded",
    "visible_file_manifest_hash":  "C997121B4C57FF0C0D342A0117F0E8496AB8D3F33F86DBEF9CB56BE7A096E55B",
    "tool_calls":  [
                       {
                           "timestamp":  "2026-06-22T16:56:57.8485817+08:00",
                           "tool":  "multi_agent_v1.spawn_agent",
                           "exit_code":  0
                       }
                   ],
    "input_hashes":  {

                     },
    "output_hashes":  {

                      },
    "status":  "RUNNING",
    "termination_reason":  null
}
