{
    "run_id":  "PH1_5-SOURCE-GUARD-IMPLEMENTATION",
    "parent_id":  "root-coordinator",
    "requested_model":  "inherited",
    "actual_model":  "inherited_parent_gpt-5.5_not_independently_reported",
    "sandbox":  "instructional_bounded",
    "visible_file_manifest_hash":  "731DE06C6B6766E6A1452522585E992910CB4CA04460D894C5914433C95DD12E",
    "tool_calls":  [
                       {
                           "timestamp":  "2026-06-22T16:56:57.8485817+08:00",
                           "tool":  "multi_agent_v1.spawn_agent",
                           "exit_code":  0
                       }
                   ],
    "input_hashes":  {

                     },
    "output_hashes":  {

                      },
    "status":  "RUNNING",
    "termination_reason":  null
}
