{
    "run_id":  "PH0-REPO-EXPLORER",
    "parent_id":  "root-coordinator",
    "requested_model":  "inherited",
    "actual_model":  "inherited_parent_gpt-5.5_not_independently_reported",
    "sandbox":  "instructional_read_only_not_os_enforced",
    "visible_file_manifest_hash":  "2F4C3CFB0E8AD7F4CE2B74B62F8604D5FB742B1DD12B98312843FDABDCE1D81E",
    "tool_calls":  [
                       {
                           "timestamp":  "2026-06-22T16:05:50.4287336+08:00",
                           "tool":  "multi_agent_v1.spawn_agent",
                           "exit_code":  0
                       },
                       {
                           "tool":  "multi_agent_v1.wait_agent",
                           "timestamp":  "2026-06-22T16:11:53.9848624+08:00",
                           "exit_code":  0
                       }
                   ],
    "input_hashes":  {

                     },
    "output_hashes":  {
                          "result_json":  "E7ACAAA02819CDD10BAC57BED95F38700A51B7D364D811D2CF0A40F9D6B79434"
                      },
    "status":  "COMPLETED",
    "termination_reason":  "child_result_NOT_VERIFIED"
}
